[
  {
    "id": "synthetic_231",
    "question": "What is the capital of Kenya?",
    "context": "Kenya's capital city is Nairobi.",
    "answer": "The company uses Python for data analysis.",
    "grounding_label": "UNSUPPORTED",
    "relevance_label": "IRRELEVANT",
    "contradiction_label": "NOT_CONTRADICTORY",
    "evidence": [],
    "source": "synthetic",
    "annotator_id": "gasim",
    "annotation_status": "LABELED",
    "annotation_notes": "Answer is unrelated to the question."
  },
  {
    "id": "synthetic_232",
    "question": "When was Acme founded?",
    "context": "Acme Technologies was founded in 2018.",
    "answer": "The office has three meeting rooms.",
    "grounding_label": "UNSUPPORTED",
    "relevance_label": "IRRELEVANT",
    "contradiction_label": "NOT_CONTRADICTORY",
    "evidence": [],
    "source": "synthetic",
    "annotator_id": "gasim",
    "annotation_status": "LABELED",
    "annotation_notes": "Context does not address the question."
  },
  {
    "id": "synthetic_233",
    "question": "What products does CloudCore sell?",
    "context": "CloudCore sells backup software and cloud storage.",
    "answer": "The company has offices in Kigali.",
    "grounding_label": "UNSUPPORTED",
    "relevance_label": "IRRELEVANT",
    "contradiction_label": "NOT_CONTRADICTORY",
    "evidence": [],
    "source": "synthetic",
    "annotator_id": "gasim",
    "annotation_status": "LABELED",
    "annotation_notes": "Context is unrelated to products."
  },
  {
    "id": "synthetic_234",
    "question": "How many employees does NovaTech have?",
    "context": "NovaTech employs 120 people.",
    "answer": "NovaTech's website uses a blue logo.",
    "grounding_label": "UNSUPPORTED",
    "relevance_label": "IRRELEVANT",
    "contradiction_label": "NOT_CONTRADICTORY",
    "evidence": [],
    "source": "synthetic",
    "annotator_id": "gasim",
    "annotation_status": "LABELED",
    "annotation_notes": "Context is unrelated to employee count."
  },
  {
    "id": "synthetic_235",
    "question": "What does GreenLabs do?",
    "context": "GreenLabs develops agricultural monitoring software.",
    "answer": "The company was founded in 2019.",
    "grounding_label": "UNSUPPORTED",
    "relevance_label": "IRRELEVANT",
    "contradiction_label": "NOT_CONTRADICTORY",
    "evidence": [],
    "source": "synthetic",
    "annotator_id": "gasim",
    "annotation_status": "LABELED",
    "annotation_notes": "Context does not describe activities."
  },
  {
    "id": "synthetic_236",
    "question": "When was BrightAI launched?",
    "context": "BrightAI launched its platform in 2022.",
    "answer": "BrightAI has a customer-support email address.",
    "grounding_label": "UNSUPPORTED",
    "relevance_label": "IRRELEVANT",
    "contradiction_label": "NOT_CONTRADICTORY",
    "evidence": [],
    "source": "synthetic",
    "annotator_id": "gasim",
    "annotation_status": "LABELED",
    "annotation_notes": "Context is unrelated to launch date."
  },
  {
    "id": "synthetic_237",
    "question": "What is the capital of Kenya?",
    "context": "Kenya's capital city is Nairobi.",
    "answer": "Kenya's capital is Paris.",
    "grounding_label": "UNSUPPORTED",
    "relevance_label": "IRRELEVANT",
    "contradiction_label": "CONTRADICTORY",
    "evidence": [
      "Kenya's capital city is Nairobi."
    ],
    "source": "synthetic",
    "annotator_id": "gasim",
    "annotation_status": "LABELED",
    "annotation_notes": "The answer is unrelated to the supplied task context."
  },
  {
    "id": "synthetic_238",
    "question": "When was Acme founded and what does it sell?",
    "context": "Acme Technologies was founded in 2018 and sells cloud security software.",
    "answer": "Acme was founded in 2018 and sells cloud security software.",
    "grounding_label": "SUPPORTED",
    "relevance_label": "RELEVANT",
    "contradiction_label": "NOT_CONTRADICTORY",
    "evidence": [
      "Acme Technologies was founded in 2018.",
      "Acme Technologies sells cloud security software."
    ],
    "source": "synthetic",
    "annotator_id": "gasim",
    "annotation_status": "LABELED",
    "annotation_notes": "Both claims are supported."
  },
  {
    "id": "synthetic_239",
    "question": "When was Acme founded and where is it headquartered?",
    "context": "Acme Technologies was founded in 2018.",
    "answer": "Acme was founded in 2018 and is headquartered in Kigali.",
    "grounding_label": "PARTIALLY_SUPPORTED",
    "relevance_label": "RELEVANT",
    "contradiction_label": "NOT_CONTRADICTORY",
    "evidence": [
      "Acme Technologies was founded in 2018."
    ],
    "source": "synthetic",
    "annotator_id": "gasim",
    "annotation_status": "LABELED",
    "annotation_notes": "First claim supported; headquarters unsupported."
  },
  {
    "id": "synthetic_240",
    "question": "When was Acme founded and how many employees does it have?",
    "context": "Acme Technologies was founded in 2018.",
    "answer": "Acme was founded in 2015 and has 500 employees.",
    "grounding_label": "UNSUPPORTED",
    "relevance_label": "RELEVANT",
    "contradiction_label": "CONTRADICTORY",
    "evidence": [
      "Acme Technologies was founded in 2018."
    ],
    "source": "synthetic",
    "annotator_id": "gasim",
    "annotation_status": "LABELED",
    "annotation_notes": "The temporal claim contradicts the context and employee count is unsupported."
  }
]
