[
  {
    "id": "synthetic_171",
    "question": "What is GreenLabs revenue?",
    "context": "GreenLabs develops agricultural monitoring software.",
    "answer": "GreenLabs generated $5 million in revenue.",
    "grounding_label": "UNSUPPORTED",
    "relevance_label": "RELEVANT",
    "contradiction_label": "NOT_CONTRADICTORY",
    "evidence": [],
    "source": "synthetic",
    "annotator_id": "gasim",
    "annotation_status": "LABELED",
    "annotation_notes": "Revenue is not stated in context."
  },
  {
    "id": "synthetic_172",
    "question": "When will DataWorks expand to Tanzania?",
    "context": "DataWorks currently operates in Rwanda and Kenya.",
    "answer": "DataWorks will expand to Tanzania next year.",
    "grounding_label": "UNSUPPORTED",
    "relevance_label": "RELEVANT",
    "contradiction_label": "NOT_CONTRADICTORY",
    "evidence": [],
    "source": "synthetic",
    "annotator_id": "gasim",
    "annotation_status": "LABELED",
    "annotation_notes": "Future expansion is not stated."
  },
  {
    "id": "synthetic_173",
    "question": "What is the capital of Kenya?",
    "context": "Kenya's capital city is Nairobi.",
    "answer": "The company uses Python for data analysis.",
    "grounding_label": "UNSUPPORTED",
    "relevance_label": "IRRELEVANT",
    "contradiction_label": "NOT_CONTRADICTORY",
    "evidence": [],
    "source": "synthetic",
    "annotator_id": "gasim",
    "annotation_status": "LABELED",
    "annotation_notes": "Answer is unrelated to the question."
  },
  {
    "id": "synthetic_174",
    "question": "When was Acme founded?",
    "context": "Acme Technologies was founded in 2018.",
    "answer": "The office has three meeting rooms.",
    "grounding_label": "UNSUPPORTED",
    "relevance_label": "IRRELEVANT",
    "contradiction_label": "NOT_CONTRADICTORY",
    "evidence": [],
    "source": "synthetic",
    "annotator_id": "gasim",
    "annotation_status": "LABELED",
    "annotation_notes": "Context does not address the question."
  },
  {
    "id": "synthetic_175",
    "question": "What products does CloudCore sell?",
    "context": "CloudCore sells backup software and cloud storage.",
    "answer": "The company has offices in Kigali.",
    "grounding_label": "UNSUPPORTED",
    "relevance_label": "IRRELEVANT",
    "contradiction_label": "NOT_CONTRADICTORY",
    "evidence": [],
    "source": "synthetic",
    "annotator_id": "gasim",
    "annotation_status": "LABELED",
    "annotation_notes": "Context is unrelated to products."
  },
  {
    "id": "synthetic_176",
    "question": "How many employees does NovaTech have?",
    "context": "NovaTech employs 120 people.",
    "answer": "NovaTech's website uses a blue logo.",
    "grounding_label": "UNSUPPORTED",
    "relevance_label": "IRRELEVANT",
    "contradiction_label": "NOT_CONTRADICTORY",
    "evidence": [],
    "source": "synthetic",
    "annotator_id": "gasim",
    "annotation_status": "LABELED",
    "annotation_notes": "Context is unrelated to employee count."
  },
  {
    "id": "synthetic_177",
    "question": "What does GreenLabs do?",
    "context": "GreenLabs develops agricultural monitoring software.",
    "answer": "The company was founded in 2019.",
    "grounding_label": "UNSUPPORTED",
    "relevance_label": "IRRELEVANT",
    "contradiction_label": "NOT_CONTRADICTORY",
    "evidence": [],
    "source": "synthetic",
    "annotator_id": "gasim",
    "annotation_status": "LABELED",
    "annotation_notes": "Context does not describe activities."
  },
  {
    "id": "synthetic_178",
    "question": "When was BrightAI launched?",
    "context": "BrightAI launched its platform in 2022.",
    "answer": "BrightAI has a customer-support email address.",
    "grounding_label": "UNSUPPORTED",
    "relevance_label": "IRRELEVANT",
    "contradiction_label": "NOT_CONTRADICTORY",
    "evidence": [],
    "source": "synthetic",
    "annotator_id": "gasim",
    "annotation_status": "LABELED",
    "annotation_notes": "Context is unrelated to launch date."
  },
  {
    "id": "synthetic_179",
    "question": "What is the capital of Kenya?",
    "context": "Kenya's capital city is Nairobi.",
    "answer": "Kenya's capital is Paris.",
    "grounding_label": "UNSUPPORTED",
    "relevance_label": "IRRELEVANT",
    "contradiction_label": "CONTRADICTORY",
    "evidence": [
      "Kenya's capital city is Nairobi."
    ],
    "source": "synthetic",
    "annotator_id": "gasim",
    "annotation_status": "LABELED",
    "annotation_notes": "The answer is unrelated to the supplied task context."
  },
  {
    "id": "synthetic_180",
    "question": "When was Acme founded and what does it sell?",
    "context": "Acme Technologies was founded in 2018 and sells cloud security software.",
    "answer": "Acme was founded in 2018 and sells cloud security software.",
    "grounding_label": "SUPPORTED",
    "relevance_label": "RELEVANT",
    "contradiction_label": "NOT_CONTRADICTORY",
    "evidence": [
      "Acme Technologies was founded in 2018.",
      "Acme Technologies sells cloud security software."
    ],
    "source": "synthetic",
    "annotator_id": "gasim",
    "annotation_status": "LABELED",
    "annotation_notes": "Both claims are supported."
  }
]
